Member_state,Heritage_element,Status_Inscribed_or_Proclaimed,Region,Start,End
Afghanistan / Azerbaijan / India / Iran / Iraq / Kazakhstan / Kyrgyzstan / Pakistan / Tajikistan / Turkey / Turkmenistan / Uzbekistan,"Nawrouz, Novruz, Nowrouz, Nowrouz, Nawrouz, Nauryz, Nooruz, Nowruz, Navruz, Nevruz, Nowruz, Navruz",inscribed,APA,2016,
Afghanistan / Azerbaijan / Iran / Turkey / Tajikistan / Turkmenistan / Uzbekistan,Sericulture and traditional production of silk for weaving,inscribed,APA,2022,
Afghanistan / Iran,Yaldā/Chella,inscribed,APA,2022,
Afghanistan / Iran,Iso-Polyphony,proclaimed,ENA,2005,
Afghanistan / Iran,Iso-Polyphony,inscribed,ENA,2008,
Albania / Andorra / Austria / Croatia / France / Greece / Italy / Luxembourg / Romania / Spain,"Transhumance, the seasonal droving of livestock",inscribed,ENA,2023,
Albania / Andorra / Austria / Croatia / France / Greece / Italy / Luxembourg / Romania / Spain,"Ritual and ceremonies of Sebiba in the oasis of Djanet, Algeria",inscribed,AST,2014,
Albania / Andorra / Austria / Croatia / France / Greece / Italy / Luxembourg / Romania / Spain,Ahellil of Gourara,proclaimed,AST,2005,
Albania / Andorra / Austria / Croatia / France / Greece / Italy / Luxembourg / Romania / Spain,Ahellil of Gourara,inscribed,AST,2008,
Albania / Andorra / Austria / Croatia / France / Greece / Italy / Luxembourg / Romania / Spain,Rites and craftsmanship associated with the wedding costume tradition of Tlemcen,inscribed,AST,2012,
Albania / Andorra / Austria / Croatia / France / Greece / Italy / Luxembourg / Romania / Spain,Annual pilgrimage to the mausoleum of Sidi 'Abd el-Qader Ben Mohammed (Sidi Cheikh),inscribed,AST,2017,
Albania / Andorra / Austria / Croatia / France / Greece / Italy / Luxembourg / Romania / Spain,"Sbuâ, annual pilgrimage to the zawiya of Sidi El Hadj Belkacem in Gourara",inscribed,AST,2015,
Albania / Andorra / Austria / Croatia / France / Greece / Italy / Luxembourg / Romania / Spain,"Raï, popular folk song of Algeria",inscribed,AST,2022,
Andorra / France,Bear festivities in the Pyrenees,inscribed,ENA,2022,
Andorra / France / Spain,Summer solstice fire festivals in the Pyrenees,inscribed,ENA,2015,
Andorra / France / Spain,"Sona, drawings and geometric figures on sand",inscribed,AFR,2023,
Andorra / France / Spain,"Filete porteño in Buenos Aires, a traditional painting technique",inscribed,LAC,2015,
Andorra / France / Spain,Chamamé,inscribed,LAC,2020,
Argentina / Uruguay,Tango,inscribed,LAC,2009,
Argentina / Uruguay,Duduk and its music,proclaimed,ENA,2005,
Argentina / Uruguay,Duduk and its music,inscribed,ENA,2008,
Argentina / Uruguay,Armenian cross-stones art. Symbolism and craftsmanship of Khachkars,inscribed,ENA,2010,
Argentina / Uruguay,Performance of the Armenian epic of 'Daredevils of Sassoun' or 'David of Sassoun',inscribed,ENA,2012,
Argentina / Uruguay,"Lavash, the preparation, meaning and appearance of traditional bread as an expression of culture in Armenia",inscribed,ENA,2014,
Argentina / Uruguay,"Kochari, traditional group dance",inscribed,ENA,2017,
Argentina / Uruguay,Armenian letter art and its cultural expressions,inscribed,ENA,2019,
Argentina / Uruguay,Tradition of blacksmithing in Gyumri,inscribed,ENA,2023,
Armenia / Iran,"Pilgrimage to the St. Thaddeus Apostle Monastery, Saint Stepanos Monastery, Chapel of Dzordzor, Chapel of Chupan, Church of the Holy Mother of God, Darashamb.",inscribed,APA,2020,
Armenia / Iran,"Schemenlaufen, the carnival of Imst, Austria",inscribed,ENA,2012,
Armenia / Iran,Classical horsemanship and the High School of the Spanish Riding School Vienna,inscribed,ENA,2015,
Austria / Belgium / Croatia / Czech Republic / France / Germany / Hungary / Ireland / Italy / Kazakhstan / South Korea / Kyrgyzstan / Mongolia / Netherlands / Morocco / Pakistan / Poland / Portugal / Qatar / Saudi Arabia / Slovakia / Spain / Syria / United Arab Emirates,"Falconry, a living human heritage",inscribed,"AFR, APA, AST, ENA",2021,
Austria / Belgium / Germany / Italy / Luxembourg / Netherlands /  / Switzerland,"Traditional irrigation: knowledge, technique, and organization",inscribed,ENA,2023,
Austria / Bosnia and Herzegovina / Croatia / Hungary / Italy / Romania / Slovakia / Slovenia,Lipizzan horse breeding traditions,inscribed,ENA,2022,
Austria / Czech Republic / Germany / Hungary / Slovakia,"Blaudruck/Modrotisk/Kékfestés/Modrotlač, resist block printing and indigo dyeing in Europe",inscribed,ENA,2018,
Austria / Czech Republic / Germany / Latvia / Poland / Spain,Timber rafting,inscribed,ENA,2022,
Austria / Greece / Italy / Romania,"Transhumance, the seasonal droving of livestock along migratory routes in the Mediterranean and in the Alps",inscribed,ENA,2019,
Austria /  / Switzerland,Avalanche risk management,inscribed,ENA,2018,
Austria /  / Switzerland,Azerbaijani Mugham,proclaimed,APA,2003,
Austria /  / Switzerland,Azerbaijani Mugham,inscribed,APA,2008,
Austria /  / Switzerland,Art of Azerbaijani Ashiq,inscribed,APA,2009,
Austria /  / Switzerland,Traditional art of Azerbaijani carpet weaving in the Republic of Azerbaijan,inscribed,APA,2010,
Austria /  / Switzerland,"Craftsmanship and performance art of the Tar, a long-necked string musical instrument",inscribed,APA,2012,
Austria /  / Switzerland,"Traditional art and symbolism of Kelaghayi, making and wearing women's silk headscarves",inscribed,APA,2014,
Austria /  / Switzerland,Copper craftsmanship of Lahij,inscribed,APA,2015,
Austria /  / Switzerland,"Dolma making and sharing tradition, a marker of cultural identity",inscribed,APA,2017,
Austria /  / Switzerland,"Nar Bayrami, traditional pomegranate festivity and culture",inscribed,APA,2020,
Austria /  / Switzerland,"Pehlevanliq culture: traditional zorkhana games, sports and wrestling",inscribed,APA,2022,
Azerbaijan / Iran,"Art of crafting and playing with Kamantcheh/Kamancha, a bowed string musical instrument",inscribed,APA,2017,
Azerbaijan / Iran / Tajikistan / Turkey / Uzbekistan,Art of illumination: Təzhib/Tazhib/Zarhalkori/Tezhip/Naqqoshlik,inscribed,APA,2023,
Azerbaijan / Iran / Turkey / Uzbekistan,Art of miniature,inscribed,APA,2020,
Azerbaijan / Iran / Turkey / Uzbekistan,Iftar/Eftari/Iftar/Iftor and its socio-cultural traditions,inscribed,APA,2023,
Azerbaijan / Iran / Kazakhstan / Kyrgyzstan / Turkey,"Flatbread making and sharing culture: Lavash, Katyrma, Jupka, Yufka",inscribed,APA,2016,
Azerbaijan / Kazakhstan / Kyrgyzstan / Tajikistan / Turkey / Turkmenistan / Uzbekistan,Telling tradition of Nasreddin Hodja/ Molla Nesreddin/ Molla Ependi/ Apendi/ Afendi Kozhanasyr Anecdotes,inscribed,APA,2022,
Azerbaijan / Kazakhstan / Turkey,"Heritage of Dede Qorqud/Korkyt Ata/Dede Korkut, epic culture, folk tales and music",inscribed,APA,2018,
Azerbaijan / Turkey,"Culture of Çay (tea), a symbol of identity, hospitality and social interaction",inscribed,APA,2022,
Azerbaijan / Turkey,Craftsmanship and performing art of balaban/mey,inscribed,APA,2023,
Azerbaijan / Turkey,Craftsmanship of mother of pearl inlay,inscribed,APA,2023,
Azerbaijan / Turkey,Junkanoo,inscribed,LAC,2023,
Azerbaijan / Turkey,Fjiri,inscribed,ARB,2021,
Bahrain / Egypt / Iraq / Jordan / Kuwait / Mauritania / Morocco / Oman / Palestine / Saudi Arabia / Sudan / Tunisia / United Arab Emirates / Yemen,"Date palm, knowledge, skills, traditions and practices",inscribed,ARB,2019,
Bahrain / Egypt / Iraq / Jordan / Kuwait / Mauritania / Morocco / Oman / Palestine / Saudi Arabia / Sudan / Tunisia / United Arab Emirates / Yemen,"Date palm, knowledge, skills, traditions and practices",inscribed,ARB,2022,
Bahrain / Egypt / Iraq / Jordan / Kuwait / Mauritania / Morocco / Oman / Palestine / Saudi Arabia / Sudan / Tunisia / United Arab Emirates / Yemen,Baul songs,proclaimed,APA,2005,
Bahrain / Egypt / Iraq / Jordan / Kuwait / Mauritania / Morocco / Oman / Palestine / Saudi Arabia / Sudan / Tunisia / United Arab Emirates / Yemen,Baul songs,inscribed,APA,2008,
Bahrain / Egypt / Iraq / Jordan / Kuwait / Mauritania / Morocco / Oman / Palestine / Saudi Arabia / Sudan / Tunisia / United Arab Emirates / Yemen,Traditional art of Jamdani weaving,inscribed,APA,2013,
Bahrain / Egypt / Iraq / Jordan / Kuwait / Mauritania / Morocco / Oman / Palestine / Saudi Arabia / Sudan / Tunisia / United Arab Emirates / Yemen,Mangal Shobhajatra on Pahela Baishakh,inscribed,APA,2016,
Bahrain / Egypt / Iraq / Jordan / Kuwait / Mauritania / Morocco / Oman / Palestine / Saudi Arabia / Sudan / Tunisia / United Arab Emirates / Yemen,Traditional art of Shital Pati weaving of Sylhet,inscribed,APA,2017,
Bahrain / Egypt / Iraq / Jordan / Kuwait / Mauritania / Morocco / Oman / Palestine / Saudi Arabia / Sudan / Tunisia / United Arab Emirates / Yemen,Rickshaws & Rickshaw painting in Dhaka,inscribed,APA,2023,
Bahrain / Egypt / Iraq / Jordan / Kuwait / Mauritania / Morocco / Oman / Palestine / Saudi Arabia / Sudan / Tunisia / United Arab Emirates / Yemen,Annual celebration in honor of Our Lady of Budslau,inscribed,ENA,2018,
Bahrain / Egypt / Iraq / Jordan / Kuwait / Mauritania / Morocco / Oman / Palestine / Saudi Arabia / Sudan / Tunisia / United Arab Emirates / Yemen,"Straw weaving in Belarus, art, craft and skills",inscribed,ENA,2022,
Belarus / Poland,Tree beekeeping culture,inscribed,ENA,2020,
Belarus / Poland,Carnival of Binche,proclaimed,ENA,2003,
Belarus / Poland,Carnival of Binche,inscribed,ENA,2008,
Belarus / Poland,Procession of the Holy Blood in Bruges,inscribed,ENA,2009,
Belarus / Poland,"Houtem Jaarmarkt, annual winter fair and livestock market at Sint-Lievens-Houtem",inscribed,ENA,2010,
Belarus / Poland,"Krakelingen and Tonnekensbrand, end-of-winter bread and fire feast at Geraardsbergen",inscribed,ENA,2010,
Belarus / Poland,Leuven age set ritual repertoire,inscribed,ENA,2011,
Belarus / Poland,Marches of Entre-Sambre-et-Meuse,inscribed,ENA,2012,
Belarus / Poland,Shrimp fishing on horseback in Oostduinkerke,inscribed,ENA,2013,
Belarus / Poland,Beer culture in Belgium,inscribed,ENA,2016,
Belarus / Poland,"Ommegang of Brussels, an annual historical procession and popular festival",inscribed,ENA,2019,
Belarus / Poland,Namur stilt jousting,inscribed,ENA,2021,
Belgium / France,Processional giants and dragons in Belgium and France,proclaimed,ENA,2005,
Belgium / France,Processional giants and dragons in Belgium and France,inscribed,ENA,2008,
Belgium / France / Italy / Luxembourg,"Musical art of horn players, an instrumental technique linked to singing, breath control, vibrato, resonance of place and conviviality",inscribed,ENA,2020,
Benin / Nigeria / Togo,Oral heritage of Gelede,proclaimed,AFR,2001,
Benin / Nigeria / Togo,Oral heritage of Gelede,inscribed,AFR,2008,
Benin / Nigeria / Togo,Mask dance of the drums from Drametse,proclaimed,APA,2005,
Benin / Nigeria / Togo,Mask dance of the drums from Drametse,inscribed,APA,2008,
Benin / Nigeria / Togo,Andean cosmovision of the Kallawaya,proclaimed,LAC,2003,
Benin / Nigeria / Togo,Andean cosmovision of the Kallawaya,inscribed,LAC,2008,
Benin / Nigeria / Togo,Carnival of Oruro,proclaimed,LAC,2001,
Benin / Nigeria / Togo,Carnival of Oruro,inscribed,LAC,2008,
Benin / Nigeria / Togo,"Ichapekene Piesta, the biggest festival of San Ignacio de Moxos",inscribed,LAC,2012,
Benin / Nigeria / Togo,"Pujllay and Ayarichi, music and dances of the Yampara culture",inscribed,LAC,2014,
Benin / Nigeria / Togo,Ritual journeys in La Paz during Alasita,inscribed,LAC,2017,
Benin / Nigeria / Togo,The festival of the Santísima Trinidad del Señor Jesús del Gran Poder in the city of La Paz,inscribed,LAC,2019,
Benin / Nigeria / Togo,Grand Festival of Tarija,inscribed,LAC,2021,
Benin / Nigeria / Togo,"Ch'utillos, the Festival of San Bartolomé and San Ignacio de Loyola, the meeting of cultures in Potosí",inscribed,LAC,2023,
Benin / Nigeria / Togo,Zmijanje embroidery,inscribed,ENA,2014,
Benin / Nigeria / Togo,Konjic woodcarving,inscribed,ENA,2017,
Benin / Nigeria / Togo,Picking of iva grass on Ozren mountain,inscribed,ENA,2018,
Benin / Nigeria / Togo,Grass mowing competition custom in Kupres,inscribed,ENA,2020,
Benin / Nigeria / Togo,Oral and graphic expressions of the Wajapi,proclaimed,LAC,2003,
Benin / Nigeria / Togo,Oral and graphic expressions of the Wajapi,inscribed,LAC,2008,
Benin / Nigeria / Togo,Samba de Roda of the Recôncavo of Bahia,proclaimed,LAC,2005,
Benin / Nigeria / Togo,Samba de Roda of the Recôncavo of Bahia,inscribed,LAC,2008,
Benin / Nigeria / Togo,"Frevo, performing arts of the Carnival of Recife",inscribed,LAC,2012,
Benin / Nigeria / Togo,"Círio de Nazaré (The Taper of Our Lady of Nazareth) in the city of Belém, Pará",inscribed,LAC,2013,
Benin / Nigeria / Togo,Capoeira circle,inscribed,LAC,2014,
Benin / Nigeria / Togo,Cultural Complex of Bumba-meu-boi from Maranhão,inscribed,LAC,2019,
Benin / Nigeria / Togo,"Bistritsa Babi, archaic polyphony, dances and rituals from the Shoplouk region",proclaimed,ENA,2005,
Benin / Nigeria / Togo,"Bistritsa Babi, archaic polyphony, dances and rituals from the Shoplouk region",inscribed,ENA,2008,
Benin / Nigeria / Togo,"Nestinarstvo, messages from the past: the Panagyr of Saints Constantine and Helena in the village of Bulgari",inscribed,ENA,2009,
Benin / Nigeria / Togo,The tradition of carpet-making in Chiprovtsi,inscribed,ENA,2014,
Benin / Nigeria / Togo,Surva folk feast in Pernik region,inscribed,ENA,2015,
Benin / Nigeria / Togo,"Visoko multipart singing from Dolen and Satovcha, South-western Bulgaria",inscribed,ENA,2021,
Bulgaria / North Macedonia / Moldova / Romania,Cultural practices associated with 1 March,inscribed,ENA,2017,
Cambodia / Philippines / South Korea / Vietnam,Tugging rituals and games,inscribed,APA,2015,
Cambodia / Philippines / South Korea / Vietnam,"Nguon, rituals of governance and associated expressions in the Bamoun community",inscribed,AFR,2023,
Cambodia / Philippines / South Korea / Vietnam,Polyphonic singing of the Aka Pygmies of Central Africa,proclaimed,AFR,2003,
Cambodia / Philippines / South Korea / Vietnam,Polyphonic singing of the Aka Pygmies of Central Africa,inscribed,AFR,2008,
Cambodia / Philippines / South Korea / Vietnam,Baile Chino,inscribed,LAC,2014,
Cambodia / Philippines / South Korea / Vietnam,Kun Qu opera,proclaimed,APA,2001,
Cambodia / Philippines / South Korea / Vietnam,Kun Qu opera,inscribed,APA,2008,
Cambodia / Philippines / South Korea / Vietnam,Guqin and its music,proclaimed,APA,2003,
Cambodia / Philippines / South Korea / Vietnam,Guqin and its music,inscribed,APA,2008,
Cambodia / Philippines / South Korea / Vietnam,Uyghur Muqam of Xinjiang,proclaimed,APA,2005,
Cambodia / Philippines / South Korea / Vietnam,Uyghur Muqam of Xinjiang,inscribed,APA,2008,
Cambodia / Philippines / South Korea / Vietnam,Art of Chinese seal engraving,inscribed,APA,2009,
Cambodia / Philippines / South Korea / Vietnam,China engraved block printing technique,inscribed,APA,2009,
Cambodia / Philippines / South Korea / Vietnam,Chinese calligraphy,inscribed,APA,2009,
Cambodia / Philippines / South Korea / Vietnam,Chinese paper-cut,inscribed,APA,2009,
Cambodia / Philippines / South Korea / Vietnam,Chinese traditional architectural craftsmanship for timber-framed structures,inscribed,APA,2009,
Cambodia / Philippines / South Korea / Vietnam,Craftsmanship of Nanjing yunjin brocade,inscribed,APA,2009,
Cambodia / Philippines / South Korea / Vietnam,Dragon Boat festival,inscribed,APA,2009,
Cambodia / Philippines / South Korea / Vietnam,Pungmul (Farmers' dance of China's Korean ethnic group),inscribed,APA,2009,
Cambodia / Philippines / South Korea / Vietnam,Gesar epic tradition,inscribed,APA,2009,
Cambodia / Philippines / South Korea / Vietnam,Grand song of the Dong ethnic group,inscribed,APA,2009,
Cambodia / Philippines / South Korea / Vietnam,Hua'er,inscribed,APA,2009,
Cambodia / Philippines / South Korea / Vietnam,Manas,inscribed,APA,2009,
Cambodia / Philippines / South Korea / Vietnam,Mazu belief and customs,inscribed,APA,2009,
Cambodia / Philippines / South Korea / Vietnam,Nanyin,inscribed,APA,2009,
Cambodia / Philippines / South Korea / Vietnam,Regong arts,inscribed,APA,2009,
Cambodia / Philippines / South Korea / Vietnam,Sericulture and silk craftsmanship of China,inscribed,APA,2009,
Cambodia / Philippines / South Korea / Vietnam,Tibetan opera,inscribed,APA,2009,
Cambodia / Philippines / South Korea / Vietnam,Traditional firing technology of Longquan celadon,inscribed,APA,2009,
Cambodia / Philippines / South Korea / Vietnam,Traditional handicrafts of making Xuan paper,inscribed,APA,2009,
Cambodia / Philippines / South Korea / Vietnam,Xi'an wind and percussion ensemble,inscribed,APA,2009,
Cambodia / Philippines / South Korea / Vietnam,Yueju opera,inscribed,APA,2009,
Cambodia / Philippines / South Korea / Vietnam,Acupuncture and moxibustion of traditional Chinese medicine,inscribed,APA,2010,
Cambodia / Philippines / South Korea / Vietnam,Peking opera,inscribed,APA,2010,
Cambodia / Philippines / South Korea / Vietnam,Chinese shadow puppetry,inscribed,APA,2011,
Cambodia / Philippines / South Korea / Vietnam,"Chinese Zhusuan, knowledge and practices of mathematical calculation through the abacus",inscribed,APA,2013,
Cambodia / Philippines / South Korea / Vietnam,"The Twenty-Four Solar Terms, knowledge of time and practices developed in China through observation of the sun's annual motion",inscribed,APA,2016,
Cambodia / Philippines / South Korea / Vietnam,"Lum medicinal bathing of Sowa Rigpa, knowledge and practices concerning life, health and illness prevention and treatment among the Tibetan people in China",inscribed,APA,2018,
Cambodia / Philippines / South Korea / Vietnam,Taijiquan,inscribed,APA,2020,
Cambodia / Philippines / South Korea / Vietnam,Traditional tea processing techniques and associated social practices in China,inscribed,APA,2022,
China / Mongolia,Mongolian Urtiin Duu – Traditional Folk Long Song,proclaimed,APA,2005,
China / Mongolia,Mongolian Urtiin Duu – Traditional Folk Long Song,inscribed,APA,2008,
China / Malaysia,"Ong Chun/Wangchuan/Wangkang ceremony, rituals and related practices for maintaining the sustainable connection between man and the ocean",inscribed,APA,2020,
China / Malaysia,Carnival of Barranquilla,proclaimed,LAC,2003,
China / Malaysia,Carnival of Barranquilla,inscribed,LAC,2008,
China / Malaysia,Cultural space of Palenque de San Basilio,proclaimed,LAC,2005,
China / Malaysia,Cultural space of Palenque de San Basilio,inscribed,LAC,2008,
China / Malaysia,Carnaval de Negros y Blancos,inscribed,LAC,2009,
China / Malaysia,Holy Week processions in Popayán,inscribed,LAC,2009,
China / Malaysia,"Wayuu normative system, applied by the Pütchipü'üi (palabrero)",inscribed,LAC,2010,
China / Malaysia,Traditional knowledge of the jaguar shamans of Yuruparí,inscribed,LAC,2011,
China / Malaysia,"Festival of Saint Francis of Assisi, Quibdó",inscribed,LAC,2012,
China / Malaysia,"Ancestral system of knowledge of the four indigenous peoples, Arhuaco, Kankuamo, Kogui and Wiwa of the Sierra Nevada de Santa Marta",inscribed,LAC,2022,
Colombia / Cyprus / Germany / Kyrgyzstan / Luxembourg / Nigeria / Slovenia / Togo,"Midwifery: knowledge, skills and practices",inscribed,"LAC, ENA, AST, AFR",2023,
Colombia / Ecuador,"Marimba music, traditional chants and dances from the Colombia South Pacific region and Esmeraldas Province of Ecuador",inscribed,LAC,2015,
Colombia / Ecuador,Oxherding and oxcart traditions in Costa Rica,proclaimed,LAC,2005,
Colombia / Ecuador,Oxherding and oxcart traditions in Costa Rica,inscribed,LAC,2008,
Colombia / Ecuador,"Gbofe of Afounkaha, the music of the transverse trumps of the Tagbana community",proclaimed,AFR,2001,
Colombia / Ecuador,"Gbofe of Afounkaha, the music of the transverse trumps of the Tagbana community",inscribed,AFR,2008,
Colombia / Ecuador,"Zaouli, popular music and dance of the Guro communities in Côte d'Ivoire",inscribed,AFR,2017,
Colombia / Ecuador,Traditional skills of loincloth weaving in Côte d’Ivoire,inscribed,AFR,2023,
Colombia / Ecuador,"Zvončari, annual carnival bell ringers' pageant from the Kastav area",inscribed,ENA,2009,
Colombia / Ecuador,"Festivity of Saint Blaise, the patron of Dubrovnik",inscribed,ENA,2009,
Colombia / Ecuador,Lacemaking in Croatia,inscribed,ENA,2009,
Colombia / Ecuador,Procession Za Krizen ('following the cross') on the island of Hvar,inscribed,ENA,2009,
Colombia / Ecuador,Spring procession of Ljelje/Kraljice (queens) from Gorjani,inscribed,ENA,2009,
Colombia / Ecuador,Traditional manufacturing of children's wooden toys in Hrvatsko Zagorje,inscribed,ENA,2009,
Colombia / Ecuador,Two-part singing and playing in the Istrian scale,inscribed,ENA,2009,
Colombia / Ecuador,Gingerbread craft from Northern Croatia,inscribed,ENA,2010,
Colombia / Ecuador,"Sinjska alka, a knights' tournament in Sinj",inscribed,ENA,2010,
Colombia / Ecuador,Bećarac singing and playing from Eastern Croatia,inscribed,ENA,2011,
Colombia / Ecuador,"Nijemo Kolo, silent circle dance of the Dalmatian hinterland",inscribed,ENA,2011,
Colombia / Ecuador,"Klapa multipart singing of Dalmatia, southern Croatia",inscribed,ENA,2012,
Colombia / Ecuador,"Međimurska popevka, a folksong from Međimurje",inscribed,ENA,2018,
Colombia / Ecuador,"Festivity of Saint Tryphon and the Kolo (chain dance) of Saint Tryphon, traditions of Croats from Boka Kotorska (Bay of Kotor) who live in the Republic of Croatia",inscribed,ENA,2022,
Croatia / Cyprus / France / Greece / Italy / Slovenia / Spain /  / Switzerland,"Art of dry stone walling, knowledge and techniques",inscribed,ENA,2018,
Croatia / Cyprus / Greece / Italy / Morocco / Portugal / Spain,"Mediterranean diet
(In 2010, Italy, Spain, Greece and Morocco were the first to be recognised, but on 4 December 2013, Portugal, Cyprus and Croatia were also recognised by UNESCO.)",inscribed,"ENA, AFR",2013,
Croatia / Cyprus / Greece / Italy / Morocco / Portugal / Spain,"La Tumba Francesa, a secular Afro-Cuban genre of dance, song, and drumming",proclaimed,LAC,2003,
Croatia / Cyprus / Greece / Italy / Morocco / Portugal / Spain,"La Tumba Francesa, a secular Afro-Cuban genre of dance, song, and drumming",inscribed,LAC,2008,
Croatia / Cyprus / Greece / Italy / Morocco / Portugal / Spain,"Rumba in Cuba, a festive combination of music and dances and all the practices associated",inscribed,LAC,2016,
Croatia / Cyprus / Greece / Italy / Morocco / Portugal / Spain,Punto,inscribed,LAC,2017,
Croatia / Cyprus / Greece / Italy / Morocco / Portugal / Spain,Festivity of Las Parrandas in the centre of Cuba,inscribed,LAC,2018,
Croatia / Cyprus / Greece / Italy / Morocco / Portugal / Spain,Knowledge of the light rum masters,inscribed,LAC,2022,
Cuba / Mexico,"Bolero: identity, emotion and poetry turned into song",inscribed,LAC,2023,
Cuba / Mexico,Lefkara laces or Lefkaritika,inscribed,ENA,2009,
Cuba / Mexico,Tsiattista poetic duelling,inscribed,ENA,2011,
Czech Republic / Finland / France / Germany / Hungary / Spain,"Knowledge, craft and skills of handmade glass production",inscribed,ENA,2023,
Czech Republic / Slovakia,Puppetry in Slovakia and Czechia,inscribed,ENA,2016,
Denmark / Finland / Iceland / Norway / Sweden,Nordic clinker boat traditions,inscribed,ENA,2021,
Denmark / Finland / Iceland / Norway / Sweden,Cultural Space of the Brotherhood of the Holy Spirit of the Congos of Villa Mella,proclaimed,LAC,2001,
Denmark / Finland / Iceland / Norway / Sweden,Cultural Space of the Brotherhood of the Holy Spirit of the Congos of Villa Mella,inscribed,LAC,2008,
Denmark / Finland / Iceland / Norway / Sweden,Cocolo Dance Drama Tradition,proclaimed,LAC,2005,
Denmark / Finland / Iceland / Norway / Sweden,Cocolo Dance Drama Tradition,inscribed,LAC,2008,
Denmark / Finland / Iceland / Norway / Sweden,Music and dance of the merengue,inscribed,LAC,2016,
Denmark / Finland / Iceland / Norway / Sweden,Music and dance of Bachata,inscribed,LAC,2019,
Denmark / Finland / Iceland / Norway / Sweden,Traditional weaving of the Ecuadorian toquilla straw hat,inscribed,LAC,2012,
Denmark / Finland / Iceland / Norway / Sweden,"Pasillo, song and poetry",inscribed,LAC,2021,
France / Italy,The art of glass beads,inscribed,ENA,2020,
France / Italy /  / Switzerland,Alpinism,inscribed,ENA,2019,
France /  / Switzerland,Craftsmanship of mechanical watchmaking and art mechanics,inscribed,ENA,2020,
Indonesia / Malaysia,Pantun,inscribed,APA,2020,
Indonesia / Malaysia,Radif of Iranian music,inscribed,APA,2009,
Indonesia / Malaysia,Traditional skills of carpet weaving in Kashan,inscribed,APA,2010,
Indonesia / Malaysia,Traditional skills of carpet weaving in Fars,inscribed,APA,2010,
Indonesia / Malaysia,Ritual dramatic art of Ta'zīye,inscribed,APA,2010,
Indonesia / Malaysia,Pahlevani and Zoorkhanei rituals,inscribed,APA,2010,
Indonesia / Malaysia,Music of the Bakhshis of Khorasan,inscribed,APA,2010,
Indonesia / Malaysia,Qālišuyān rituals of Mašhad-e Ardehāl in Kāšān,inscribed,APA,2012,
Indonesia / Malaysia,"Chogān, a horse-riding game accompanied by music and storytelling",inscribed,APA,2017,
Indonesia / Malaysia,Traditional skills of crafting and playing Dotār,inscribed,APA,2019,
Iran / Syria,Crafting and playing the Oud,inscribed,"APA, ARB",2022,
Iran / Tajikistan,Sadeh/Sada celebration,inscribed,APA,2023,
Iran / Tajikistan,The Iraqi Maqam,proclaimed,AST,2003,
Iran / Tajikistan,The Iraqi Maqam,inscribed,AST,2008,
Iran / Tajikistan,Provision of services and hospitality during the Arba'een visitation,inscribed,AST,2019,
Iran / Tajikistan,Traditional craft skills and arts of Al-Naoor,inscribed,AST,2021,
Iran / Tajikistan,Traditional craft skills and arts of Al-Mudhif building,inscribed,AST,2023,
Iraq / Algeria / Egypt / Mauritania / Morocco / Palestine / Saudi Arabia / Sudan / Tunisia / Yemen,"Arts, skills and practices associated with engraving on metals (gold, silver and copper)",inscribed,"AST, ARB",2023,
Iraq / Algeria / Egypt / Mauritania / Morocco / Palestine / Saudi Arabia / Sudan / Tunisia / Yemen,Uilleann piping,inscribed,ENA,2017,
